{
  "schemaVersion": "1.0.0",
  "id": "cmd_000000000000000000000007",
  "type": "command.submit",
  "source": "ios",
  "rawInput": "capture inbox note",
  "timestamp": "2026-06-23T16:00:06.000Z",
  "correlationId": null,
  "payload": {
    "reservedProducer": "ios"
  },
  "privacy": {
    "sensitivity": "private",
    "cloudPolicy": "deny"
  }
}
