{
  "schemaVersion": "1.0.0",
  "id": "cmd_000000000000000000000006",
  "type": "command.submit",
  "source": "voice",
  "rawInput": "open developer mode",
  "timestamp": "2026-06-23T16:00:05.000Z",
  "correlationId": null,
  "payload": {
    "reservedProducer": "voice"
  },
  "privacy": {
    "sensitivity": "private",
    "cloudPolicy": "deny"
  }
}
