{
  "schemaVersion": "1.0.0",
  "id": "cmd_000000000000000000000003",
  "type": "command.submit",
  "source": "cli",
  "rawInput": "status",
  "timestamp": "2026-06-23T16:00:02.000Z",
  "correlationId": null,
  "payload": {
    "toolId": "system.status.read"
  },
  "privacy": {
    "sensitivity": "private",
    "cloudPolicy": "deny"
  }
}
