{
  "schemaVersion": "1.0.0",
  "id": "cmd_000000000000000000000008",
  "type": "command.submit",
  "source": "agent",
  "rawInput": "propose project summary",
  "timestamp": "2026-06-23T16:00:07.000Z",
  "correlationId": null,
  "payload": {
    "reservedProducer": "agent"
  },
  "privacy": {
    "sensitivity": "private",
    "cloudPolicy": "deny"
  }
}
